Rank,Candidate,File,Overall Score,Skill Match,Semantic Similarity,Experience Score,Education Score,Matched Skills,Missing Skills,Experience (Years)
1,Unknown Candidate,Resume_B_Nithin_Singh_Rajpurohith.pdf,57.79,100.0,0.0,0.0,100.0,"github actions, tailwind css, javascript, typescript, next.js, node.js, express, mongodb, github, react, sql, git, css",None,0.0
2,Unknown Candidate,resume_alice.pdf,48.61,30.77,0.0,100.0,100.0,"express, github, sql, git","github actions, tailwind css, javascript, typescript, next.js, node.js, mongodb, react, css",4.0
3,Unknown Candidate,resume_dave.pdf,47.94,30.77,0.0,100.0,100.0,"github actions, github, sql, git","tailwind css, javascript, typescript, next.js, node.js, express, mongodb, react, css",12.0
4,Unknown Candidate,resume_bob.pdf,44.61,23.08,0.0,100.0,100.0,"github, sql, git","github actions, tailwind css, javascript, typescript, next.js, node.js, express, mongodb, react, css",3.0
5,Unknown Candidate,resume_eve.pdf,31.15,46.15,0.0,0.0,70.0,"tailwind css, javascript, github, sql, git, css","github actions, typescript, next.js, node.js, express, mongodb, react",0.0
